{
  "$schema": "https://json-schema.org/draft/2020-12/schema",
  "title": "ReleaseIntentItem",
  "type": "object",
  "required": [
    "workload_id",
    "repo",
    "release_reason"
  ],
  "properties": {
    "workload_id": {
      "type": "string"
    },
    "repo": {
      "type": "string"
    },
    "image_digest": {
      "type": "string"
    },
    "release_reason": {
      "type": "string"
    }
  },
  "additionalProperties": false
}
